name,description,task_type,evaluated_ability,metrics,paper_url,code_url,dataset_url,leaderboard_url,open_source,resource_completeness,reproduction_difficulty,teaching_value,research_value,topic_popularity,time_cost_friendliness,documentation_quality,authority,limitations,suitable_usage,evidence,mode,task_fit_score,rank,recommendation_reason
AgentBench,AgentBench 是用于 Agent Evaluation 的 Benchmark，主要关注 task planning、tool use、reasoning。,Agent Evaluation,"['task planning', 'tool use', 'reasoning']","['task success rate', 'pass rate', 'accuracy']",https://arxiv.org/abs/2308.03688,https://github.com/THUDM/AgentBench,,,True,4,3,3,5,3,3,3,5,AgentBench 主要依赖公开论文、代码或榜单信息，跨环境复现时可能需要额外配置。,适合用于 Agent Evaluation 的横向对比、课程讲解和研究分析。,"['https://arxiv.org/abs/2308.03688', 'https://github.com/THUDM/AgentBench']",科研调研,4.25,1,AgentBench 在科研调研模式下表现突出，得分 4.25，排名第一。它在科研价值（5/5）和权威性（5/5）方面均获最高评价，资源完整度良好（4/5），适合作为 Agent 评测领域的代表性 Benchmark 进行横向对比和综述调研。该 Benchmark 覆盖任务规划、工具使用和推理等核心能力，论文与代码均已开源，为相关研究提供可验证的基准。需注意其局限性在于跨环境复现可能需要额外配置。
WebArena,WebArena 是用于 Web Navigation Agent Evaluation 的 Benchmark，主要关注 web navigation、tool use、long-horizon planning。,Web Navigation Agent Evaluation,"['web navigation', 'tool use', 'long-horizon planning']","['task success rate', 'pass rate', 'accuracy']",https://arxiv.org/abs/2307.13854,https://github.com/web-arena-x/webarena,,https://webarena.dev/,True,4,3,3,5,3,3,3,5,WebArena 主要依赖公开论文、代码或榜单信息，跨环境复现时可能需要额外配置。,适合用于 Web Navigation Agent Evaluation 的横向对比、课程讲解和研究分析。,"['https://arxiv.org/abs/2307.13854', 'https://github.com/web-arena-x/webarena', 'https://webarena.dev/']",科研调研,4.25,2,WebArena 在 Web Navigation Agent 评测领域具有极高的科研价值（5/5）和权威性（5/5），在同类评测中排名第 2，Task-Fit Score 为 4.25，配套有官方榜单网站和完整代码仓库。该评测覆盖 web navigation、tool use、long-horizon planning 等核心能力，资源完整度较高（4/5），适合作为相关工作调研和代表性 Benchmark 对比的研究依据。
OSWorld,OSWorld 是用于 Computer-use Agent Evaluation 的 Benchmark，主要关注 GUI operation、desktop task solving、OS interaction。,Computer-use Agent Evaluation,"['GUI operation', 'desktop task solving', 'OS interaction']","['task success rate', 'pass rate', 'accuracy']",https://arxiv.org/abs/2404.07972,https://github.com/xlang-ai/OSWorld,,https://os-world.github.io/,True,4,3,3,5,3,3,3,5,OSWorld 主要依赖公开论文、代码或榜单信息，跨环境复现时可能需要额外配置。,适合用于 Computer-use Agent Evaluation 的横向对比、课程讲解和研究分析。,"['https://arxiv.org/abs/2404.07972', 'https://github.com/xlang-ai/OSWorld', 'https://os-world.github.io/']",科研调研,4.25,3,OSWorld 在科研调研中展现出突出的研究价值（5/5）和权威性（5/5），Task-Fit Score 达 4.25/5，排名第3，是当前 Computer-use Agent 领域极具代表性的 Benchmark。其评测能力覆盖 GUI 操作、桌面任务解决和 OS 交互三大核心能力，资源完整度较高（4/5），适合作为相关工作综述、横向对比和前沿研究的基础参考。需注意跨环境复现可能需额外配置，建议结合论文与开源代码深入验证。
SWE-bench,SWE-bench 是用于 Software Engineering Agent Evaluation 的 Benchmark，主要关注 issue resolution、patch generation、code understanding。,Software Engineering Agent Evaluation,"['issue resolution', 'patch generation', 'code understanding']","['task success rate', 'pass rate', 'accuracy', 'resolved issue rate']",https://arxiv.org/abs/2310.06770,https://github.com/swe-bench/SWE-bench,,https://www.swebench.com/,True,4,3,3,5,3,3,3,5,SWE-bench 主要依赖公开论文、代码或榜单信息，跨环境复现时可能需要额外配置。,适合用于 Software Engineering Agent Evaluation 的横向对比、课程讲解和研究分析。,"['https://arxiv.org/abs/2310.06770', 'https://github.com/swe-bench/SWE-bench', 'https://www.swebench.com/']",科研调研,4.25,4,SWE-bench 是软件工程 Agent 评测领域的代表性 Benchmark，研究价值（5/5）和权威性（5/5）均达到最高水平，任务覆盖 issue resolution、patch generation、code understanding 三大核心能力，适合在 related work 和综述调研中作为与同类工作的对比基准。资源完整度（4/5）较好且完全开源（GitHub、arXiv、官方榜单链接完整），但需注意跨环境复现可能需要额外配置。综合来看，task_fit_score 为 4.25/5，排名第 4，是科研调研场景下的可靠选择。
GAIA,GAIA 是用于 General Assistant / Agent Evaluation 的 Benchmark，主要关注 reasoning、web browsing、tool use。,General Assistant / Agent Evaluation,"['reasoning', 'web browsing', 'tool use', 'multi-step planning']","['task success rate', 'pass rate', 'accuracy']",https://arxiv.org/abs/2311.12983,,https://huggingface.co/datasets/gaia-benchmark/GAIA,https://huggingface.co/spaces/gaia-benchmark/leaderboard,False,4,3,3,4,3,3,3,5,GAIA 主要依赖公开论文、代码或榜单信息，跨环境复现时可能需要额外配置。,适合用于 General Assistant / Agent Evaluation 的横向对比、课程讲解和研究分析。,"['https://arxiv.org/abs/2311.12983', 'https://huggingface.co/datasets/gaia-benchmark/GAIA']",科研调研,4.05,5,GAIA 在科研调研中具有较高推荐度（task_fit_score 4.05，rank 5），权威性达到满分 5/5，科研价值 4/5，资源完整度 4/5，且评测能力覆盖 reasoning、web browsing、tool use、multi-step planning 四大维度，适合作为 Agent 评测方向的代表性 Benchmark 进行相关工作调研和对比分析。不过需要注意的是，该 Benchmark 并非开源，跨环境复现时可能需要额外配置，在引用时建议以论文和 Hugging Face 官方数据集为主要依据。
ToolBench,ToolBench 是用于 Tool-use Agent Evaluation 的 Benchmark，主要关注 tool calling、API understanding、parameter binding。,Tool-use Agent Evaluation,"['tool calling', 'API understanding', 'parameter binding']","['task success rate', 'pass rate', 'accuracy']",https://arxiv.org/abs/2307.16490,https://github.com/OpenBMB/ToolBench,,https://toolbench.opencompass.org.cn/,True,4,3,3,4,3,3,3,4,ToolBench 主要依赖公开论文、代码或榜单信息，跨环境复现时可能需要额外配置。,适合用于 Tool-use Agent Evaluation 的横向对比、课程讲解和研究分析。,"['https://arxiv.org/abs/2307.16490', 'https://github.com/OpenBMB/ToolBench']",科研调研,3.7,6,ToolBench 在科研调研中具有较高的适用性，其科研价值 4/5、权威性 4/5，表明该 Benchmark 在 Tool-use Agent 评测领域具有扎实的学术基础和较高的影响力。它围绕 tool calling、API understanding、parameter binding 三项核心能力提供 task success rate、pass rate、accuracy 等多维评测指标，资源完整度 4/5 且代码开源，可作为相关工作的代表性 Benchmark 进行横向对比。不过主要依赖公开资料，跨环境复现时可能需要额外配置。
